"【壹何水果】海南金煌芒果3斤香甜海南产地直发新鲜发货软糯香甜",25.9,20.0%,5.18,已售：1,结束：2023-05-28,,,壹何水果,4.34,4.57,4.52,2023-04-18 22:00:37.337
"【头茬嫩笋尖】醉湘食手工原味笋尖炭烤烟熏258g湖南毛竹春营养",9.9,26.0%,2.57,已售：148,结束：2024-12-01,,,醉湘食生鲜旗舰店,4.99,4.81,4.48,2023-04-18 22:00:37.491
" 小熊掰掰 东北黄糯玉米220克*6支/箱 真空包装 软糯香微甜低脂",23.9,15.0%,3.58,已售：6,结束：2023-05-31,,,小熊掰掰粮油旗舰店,4.55,4.95,4.77,2023-04-18 22:00:37.669
"陕西当季沙地红萝卜9斤实惠装   新鲜蔬菜水果脆甜可口【ZW】",18.9,18.0%,3.4,已售：56,结束：2025-02-01,2,,荔尊生鲜旗舰店,4.76,4.99,4.79,2023-04-18 22:00:37.818
"广西特产大红八角足干无硫大料大茴香香料调味料卤料50-1000克",8.82,23.0%,2.03,已售：16,结束：2024-04-30,,,鸿发土特产个体店,4.54,4.34,4.52,2023-04-18 22:00:37.972
"瑞福隆清真组合牛肉饼牛舌肉饼葱油饼煎烤炸0反式脂肪酸快速早餐",36.9,28.0%,10.33,已售：26,结束：2024-03-01,1,,瑞福隆旗舰店,4.88,4.94,4.86,2023-04-18 22:00:38.156
"【潮汕墨鱼丸】手工工艺2斤/4斤送酱料包新鲜肉质",68.8,15.0%,10.32,已售：1,结束：2024-02-29,,,潮丸哥生鲜食品店,4.9,4.96,4.94,2023-04-18 22:00:38.329
"【粉丝专享】老上海正宗葱油饼20片*90g速食半成品独立包装袋方便",11.9,11.0%,1.31,已售：40,结束：2023-12-31,7,,麦香逢旗舰店,4.99,4.6,4.89,2023-04-18 22:00:38.497
"2022新品正阳特产小白沙生花生米精选含量2斤装/3斤装/5斤装/10斤",21.8,8.0%,1.74,已售：631,结束：2024-01-01,6,,正阳县嘉悦食品个体店,4.63,4.54,4.37,2023-04-18 22:00:38.679
"【长白山众品源】黄糯玉米10棒 200g/棒",29.9,18.0%,5.38,已售：3160,结束：2023-05-18,2,,长白山众品源生鲜旗舰店,4.71,4.84,4.48,2023-04-18 22:00:38.839
"芳华醉高端香妃苹果营养天然果味脆爽浓郁食用清香9枚约5斤",69.9,15.0%,10.48,已售：5,结束：2023-05-31,1,,芳华醉旗舰店,4.48,4.68,4.55,2023-04-18 22:00:39.003
"胡椒猪肚鸡解冻加热即食630g*2盒鲜嫩火锅半成香味品速食鸡肉传统",69.9,15.0%,10.48,已售：25,结束：2024-01-31,1,,英鑫食品生鲜专营店,4.99,4.92,4.99,2023-04-18 22:00:39.160
"海鲜尝鲜组合韩式酱蟹+韩式酱虾（300g/盒） 顺丰冷链包邮新鲜",59.0,18.0%,10.62,已售：156,结束：2024-08-01,,,杭州嗨优食品企业店,4.73,4.76,4.77,2023-04-18 22:00:39.309
"香酥牛肉饼500g*3包15片赠鸡排120g*2包非清真早餐-珍味小梅园ZB",69.9,15.0%,10.48,已售：2045,结束：2023-07-31,1,,珍味小梅园生鲜旗舰店,4.98,4.99,4.92,2023-04-18 22:00:39.496
"广东香水柠檬一级果手打柠檬茶专用无籽爆香省内新鲜包邮1-55斤",17.9,17.0%,3.04,已售：43,结束：2023-04-30,1,,广东香水柠檬粤柠香商行,4.76,4.8,4.85,2023-04-18 22:00:39.681
"彦伯银鲳鱼500g/袋*5刺少肉多海鱼好吃美味新鲜海捕冷冻深海肉质S",69.9,13.0%,9.09,已售：1,结束：2023-10-01,,,彦伯官方旗舰店,4.96,4.95,4.71,2023-04-18 22:00:39.823
"森庄农品芋圆200g起常温甜品奶茶店专用材料家用商用自制甜品DIY",19.9,50.0%,9.95,已售：15,结束：2023-05-12,,,森庄农品旗舰店,4.98,4.43,4.64,2023-04-18 22:00:39.966
"农家日晒干豆角新货纯天然豇豆干长豆角250g",19.9,25.0%,4.98,已售：3,结束：2024-03-01,,,麦田精选,4.95,4.81,4.67,2023-04-18 22:00:40.116
"【宠粉专属】云南紫皮洋葱新鲜小圆葱甜洋葱当季蔬菜红皮5/9斤装",8.9,15.0%,1.34,已售：4,结束：2024-01-31,,,采蘩生鲜旗舰店,4.48,4.52,4.41,2023-04-18 22:00:40.249
"【齐齐打边炉】粤港澳金牌胡椒猪肚汤包加热即食懒人开胃新鲜暖汤",48.0,19.0%,9.12,已售：8,结束：2023-06-22,,,齐齐打边炉,4.73,4.5,4.78,2023-04-18 22:00:40.385
"中华丑梨滋润多汁皮薄新鲜水果农产品5斤装（5-9个）",46.9,20.0%,9.38,已售：0,结束：2023-05-31,,,老范儿的小店,4.6,4.84,4.48,2023-04-18 22:00:40.546
"【羊肚菌汤包邮】七彩食用菌菇包煲汤食材干货汤包源头【40克】",8.0,20.0%,1.6,已售：98,结束：2023-07-31,5,,锄禾农品,4.6,4.53,4.06,2023-04-18 22:00:40.672
"千味小厨G【千味酥皮豆沙春卷】236g*5袋早餐点心家庭聚餐酥脆",48.5,20.0%,9.7,已售：9,结束：2024-02-01,,,千味央厨官方旗舰店,4.95,3.37,4.63,2023-04-18 22:00:40.823
"馋嘴小妞3斤蔬菜卷饼 菠菜紫薯南瓜500g*3袋",29.9,32.0%,9.57,已售：18,结束：2023-04-30,,,馋嘴小妞生鲜旗舰店,4.98,4.83,4.35,2023-04-18 22:00:40.976
"瑞福隆清真组合牛肉饼牛舌肉饼葱油饼煎烤炸0反式脂肪酸快速早餐",36.9,25.0%,9.22,已售：16,结束：2023-08-31,1,,瑞福隆旗舰店,4.88,4.94,4.86,2023-04-18 22:00:41.115
"【产地直发】河南焦作铁棍山药5斤/箱  正宗怀山药",46.9,20.0%,9.38,已售：47,结束：2023-11-30,1,,四季甄选生鲜店,4.41,4.12,4.12,2023-04-18 22:00:41.271
"【波仔家】大别山农家林间散养乳鸽 杂粮鸽 净重6-7两现宰现杀",59.0,16.0%,9.44,已售：51,结束：2024-11-30,3,3,波仔家的生鲜店,4.37,4.39,4.55,2023-04-18 22:00:41.426
"【店主推荐】现摘新鲜云南生态云端上的沃柑5-9斤天然成熟香甜",32.8,15.0%,4.92,已售：53,结束：2023-04-30,2,,江城山里山铺农产品经营部,4.21,4.47,4.31,2023-04-18 22:00:41.604
"500g现货黑猪肉火锅食材配菜猪肉片 烧烤餐饮烤肉店肉卷鲜嫩冷冻",38.2,11.0%,4.2,已售：3,结束：2023-10-15,,,至禾食品企业店,4.53,4.51,4.78,2023-04-18 22:00:41.750
"G【千味央厨】年年有鱼糯米饭豆沙葡萄干八宝饭400g",14.8,20.0%,2.96,已售：224,结束：2024-12-31,,,千味央厨官方旗舰店,4.95,3.37,4.63,2023-04-18 22:00:41.928
"【嗨鲜族】开背大黄鱼 一条装 150g/条/袋 速冻免杀洗*5条 共750g",29.0,15.0%,4.35,已售：2,结束：2023-04-30,,,国信水产,4.56,4.76,4.61,2023-04-18 22:00:42.089
"鑫顺康香煎鸡排半成品冷冻鸡胸肉奥尔良口味80g*10片",29.9,15.0%,4.48,已售：118,结束：2024-04-07,,,鑫顺康生鲜,4.69,4.59,4.72,2023-04-18 22:00:42.258
"【食者道】拇指生煎包小笼包卡通速食速冻包子早餐半成品2袋tz",19.9,22.0%,4.38,已售：1,结束：2023-05-04,,,食者道官方旗舰店,4.84,4.53,4.96,2023-04-18 22:00:42.437
"在旗大黄米炸汤圆有火锅伴侣酥脆香甜软糯速食黑芝麻东北油炸元宵",35.9,25.0%,8.98,已售：1,结束：2023-04-30,,,馨望美食小店,4.92,4.79,4.7,2023-04-18 22:00:42.620
"【精九鲜】精九鸭脖，肉多味美。5只29元代购。",29.0,10.0%,2.9,已售：3,结束：2023-08-31,,,京九鲜卤味坊,4.6,4.41,4.71,2023-04-18 22:00:42.804
"【精九鲜】川香鸭腿--餐饮肉质劲道，五味俱全。4只装代购",29.8,10.0%,2.98,已售：5,结束：2023-08-31,,,京九鲜卤味坊,4.6,4.41,4.71,2023-04-18 22:00:42.952
"【壹何水果】四川青见果冻橙（并非爱媛果冻橙）无核5斤无渣香甜",39.9,21.0%,8.38,已售：5,结束：2024-05-31,,,壹何水果,4.34,4.57,4.52,2023-04-18 22:00:43.084
"馋嘴小妞  黑麦卷饼 黑全麦卷饼 粗粮代餐低脂早餐食品500克*4袋",11.9,34.0%,4.05,已售：11,结束：2024-02-25,1,2,馋嘴小妞生鲜旗舰店,4.98,4.83,4.35,2023-04-18 22:00:43.234
"【鲜木】四川安岳黄柠檬 11枚90g-110g独立包装 坏果包赔",9.9,10.0%,0.99,已售：2256,结束：2023-09-30,3,9,鲜木旗舰店,4.84,4.96,4.49,2023-04-18 22:00:43.373
"【世香源】锅贴蒸煎饺鲜肉玉米饺子",34.8,25.0%,8.7,已售：12,结束：2024-03-31,,,世香源速食旗舰店,4.84,4.95,4.89,2023-04-18 22:00:43.496
"派绅有机海带丝50g*3罐昆布福建霞浦特产海带干幼嫩食材海鲜干货",79.9,10.01%,8.0,已售：1,结束：2023-12-31,,,派绅食品旗舰店,4.92,4.44,4.64,2023-04-18 22:00:43.628
"MINYAO/闽耀福建福蛋可生食无铅工艺溏心黄金皮蛋变蛋松花蛋30枚",49.9,18.0%,8.98,已售：14,结束：2024-01-07,1,,闽耀生鲜旗舰店,4.51,4.65,4.57,2023-04-18 22:00:43.741
"【十亩良田】云南新鲜沃柑5斤/8斤装 晴甜化渣解腻多汁皮薄爆汁",26.9,10.0%,2.69,已售：235,结束：2024-01-31,,,十亩良田甄选,4.77,4.7,4.73,2023-04-18 22:00:43.877
"北菜园【新店冲单】有机胡萝卜250g，宝妈备选，榨汁，店满99包邮",9.8,12.0%,1.18,已售：10,结束：2023-12-31,1,3,365鲜生鲜一站购,4.62,4.6,4.69,2023-04-18 22:00:44.008
"【4袋装】潮汕特产牛筋牛肉丸火锅料广东肉丸子爆汁鲜嫩弹牙1000g",59.0,15.0%,8.85,已售：15,结束：2023-12-31,1,,万壮生鲜旗舰店,4.72,4.58,4.79,2023-04-18 22:00:44.172
"鲜肉虾肉香菇虾仁馄饨家庭速冻儿童早餐点心馄饨半成品小馄饨皮薄",55.9,15.0%,8.38,已售：8,结束：2024-01-31,1,,英鑫食品生鲜专营店,4.99,4.92,4.99,2023-04-18 22:00:44.332
"【主播推荐】今味央 黑麦全麦荞麦菠菜南瓜紫薯卷饼低脂早餐团购",29.9,30.0%,8.97,已售：45,结束：2023-07-15,1,1,今味央速食旗舰店,4.91,4.94,4.89,2023-04-18 22:00:44.514
"沂蒙老火腿纯手工果木熏烤传统腱子肉300克老火腿开袋即食火腿",23.6,15.0%,3.54,已售：2,结束：2024-05-10,,,鑫鑫旺肉食铺,4.67,4.77,4.6,2023-04-18 22:00:44.715
"Z-众品胡椒猪肚鸡600g懒人菜加热即食免切免洗免调味冷冻半成品",39.9,20.0%,7.98,已售：0,结束：2023-07-31,,,众品生鲜旗舰店,4.75,4.56,4.88,2023-04-18 22:00:44.889
"德利汉姆【顺丰包邮】鸡肉早餐爆汁烤肠230g*2袋德式风味营养早餐",36.9,20.0%,7.38,已售：2,结束：2023-06-30,,,德利汉姆生鲜旗舰店,4.51,4.53,4.56,2023-04-18 22:00:45.048
"【中农严选】海南贵妃芒2斤/3斤爆汁皮薄芒果香甜食用农产品新鲜",11.87,15.0%,1.78,已售：4,结束：2023-04-30,,,红石头生鲜旗舰店,4.76,4.99,4.58,2023-04-18 22:00:45.183
"【灯姐专属】广式面点荷花卷茶餐厅茶楼早餐花卷包子馒头面食早餐",19.8,20.0%,3.96,已售：2,结束：2025-03-06,,,大丰斋旗舰店,4.99,4.75,4.65,2023-04-18 22:00:45.332
"【现摘现发】山东草莓西红柿铁皮番茄高品质3/5斤",46.9,15.0%,7.04,已售：0,结束：2024-03-01,,,BAIGUOMAN瓜甜李下生鲜专卖店,4.55,4.96,4.5,2023-04-18 22:00:45.501
" 水果黄瓜新鲜生吃3斤当季脆嫩小青瓜青蔬菜生吃即食包邮小黄瓜",19.68,20.0%,3.94,已售：2,结束：2024-03-01,,,百鲜惠生鲜,4.42,4.7,4.57,2023-04-18 22:00:45.689
﻿"【 壹何水果】安岳柠檬1斤新鲜柠檬酸爽多汁坏果包赔黄柠檬产地发",9.9,20.0%,1.98,已售：157,结束：2023-06-30,,,壹何水果,4.34,4.57,4.52,2023-04-18 22:01:24.829
"蔚鲜来 糯米笋300g*1/3/5袋 免切免泡方便菜炒肉绝配凉拌嫩笋丝X",9.9,25.0%,2.48,已售：2,结束：2024-03-31,,,云鼎轩生鲜旗舰店,4.98,4.97,4.62,2023-04-18 22:01:24.936
"当季新鲜大青皮芒果玉芒新鲜大芒果热带水果金煌甜心3/5/9斤",19.9,20.0%,3.98,已售：2,结束：2023-10-31,,,颖畅云南特产店,3.81,4.78,4.29,2023-04-18 22:01:25.026
"蔚鲜来辣白菜 450g  经典韩式泡菜腌制酱菜榨菜咸菜 开袋即食 YS",19.9,18.0%,3.58,已售：1142,结束：2024-12-09,2,,云鼎轩生鲜旗舰店,4.98,4.97,4.62,2023-04-18 22:01:25.107
"千味小厨G 脆皮香蕉300g 网红油炸小吃香甜糕点冷藏半成品点心",39.9,20.0%,7.98,已售：1,结束：2025-02-01,,,千味央厨官方旗舰店,4.95,3.37,4.63,2023-04-18 22:01:25.202
"方小西宁波慈溪宁波特产水磨年糕真空包装3/5斤促销软糯Q弹有嚼劲",9.8,18.0%,1.76,已售：190,结束：2023-06-30,,,方小茜美食铺,4.61,4.58,4.36,2023-04-18 22:01:25.291
"派绅新鲜干贝250g 海鲜干货特产淡扇贝干瑶柱煮粥煲汤海产品罐装",39.9,10.01%,3.99,已售：10,结束：2023-12-31,1,2,派绅食品旗舰店,4.92,4.44,4.64,2023-04-18 22:01:25.397
"【梅干菜手抓饼】早餐速食速冻食品早饭半成品手抓饼家庭装正宗",15.8,23.0%,3.63,已售：3,结束：2023-12-31,2,,馋嘴小妞生鲜旗舰店,4.98,4.83,4.35,2023-04-18 22:01:25.498
"台北风味清镇葱油饼90gX20片0反式脂肪酸快速营养早餐饼半成品",29.8,25.0%,7.45,已售：1,结束：2023-07-20,,,瑞福隆旗舰店,4.88,4.94,4.86,2023-04-18 22:01:25.627
"培根肉片早餐三明治肉夹馍火锅材料烤五花手抓饼伴侣批发家用",29.9,25.0%,7.48,已售：11,结束：2023-12-30,,,玄月轩,4.41,4.62,4.71,2023-04-18 22:01:25.734
"初荷【玉米窝窝头】儿童早餐冷冻速食方便快捷半成品配菜面点组合",29.8,25.0%,7.45,已售：2,结束：2024-02-14,1,,初荷食品,4.86,4.69,4.73,2023-04-18 22:01:25.855
"【潮汕猪肉卷】2斤/4斤送酱料包手工特产肉香新鲜炒菜烧烤油炸",49.9,15.0%,7.48,已售：2,结束：2024-02-29,1,,潮丸哥生鲜食品店,4.9,4.96,4.94,2023-04-18 22:01:25.951
"金汤酸菜鱼500g半成品专用老坛酸菜独立调料包预制菜懒人加热即食",35.8,20.0%,7.16,已售：5,结束：2023-05-31,1,,鼎灿食品专营店,4.9,3.35,4.76,2023-04-18 22:01:26.063
"「活动特惠」脆嫩笋丝（180g）笋尖鲜嫩可大份量免洗营养真空袋装",32.8,22.0%,7.22,已售：63,结束：2024-02-01,1,,山不野生鲜旗舰店,4.98,4.59,4.77,2023-04-18 22:01:26.168
"【顺丰】临安天目山小香薯5斤装中果约30个左右（介意断果慎拍",24.9,16.0%,3.98,已售：5288,结束：2023-12-10,1,,小不溜生鲜旗舰店,4.19,4.58,4.76,2023-04-18 22:01:26.289
"春子妈妈玉米果粒发糕350g*4袋粗粮早餐即食冻品实惠软糯香甜",9.9,20.0%,1.98,已售：37,结束：2023-09-30,,,春子妈妈的小店,3.92,4.78,4.8,2023-04-18 22:01:26.430
"宜久郎酥皮馅饼牛肉馅饼猪肉馅饼方便营养早餐半成品速冻生面坯",29.9,25.0%,7.48,已售：19,结束：2023-06-30,1,,宜久郎食品旗舰店,4.94,4.9,4.81,2023-04-18 22:01:26.564
"汉源红花椒四川特麻贡椒特级大红袍花椒粒干麻椒花椒250g/500g",12.8,15.0%,1.92,已售：52,结束：2032-11-30,3,,巴蜀乡味,4.99,4.94,4.88,2023-04-18 22:01:26.686
"【粉丝福利】唯此小胖子酥油条早餐半成品家用速食食品",29.9,25.0%,7.48,已售：196,结束：2023-12-28,,,唯此速食旗舰店,4.95,4.79,4.71,2023-04-18 22:01:26.804
"羊肉卷羊肉片200g*3包羔羊片涮肥羊营养火锅食材",69.9,11.0%,7.69,已售：690,结束：2023-12-31,,,姚二娘食品旗舰店,4.98,4.4,4.99,2023-04-18 22:01:26.933
"小萨牛芝士牛肉卷120g*6早餐微波炉速食空气炸锅加热即食",47.25,15.0%,7.09,已售：18,结束：2023-12-01,1,,斗破食品企业店,4.81,4.73,4.87,2023-04-18 22:01:27.082
"大连海蜇头海蜇丝凉拌即食6包X218g",36.9,20.0%,7.38,已售：877,结束：2023-11-30,1,,金波罗海产品商城,4.95,4.91,4.26,2023-04-18 22:01:27.186
"姚二娘金汤酸菜鱼450g/盒  金汤酸菜鱼片半成品美味方便懒人菜",49.9,15.0%,7.48,已售：13,结束：2024-01-31,1,,英鑫食品生鲜专营店,4.99,4.92,4.99,2023-04-18 22:01:27.273
"【哇藕】酸辣泡藕簪泡椒藕簪头藕尖藕芽带400g下饭菜泡菜",9.9,25.0%,2.48,已售：28,结束：2024-01-07,,,哇藕食品旗舰店,4.96,4.88,4.88,2023-04-18 22:01:27.366
"顺誉食品广东省内包邮韭菜饺子广式早餐早点传统粤式点心565克",45.0,17.0%,7.65,已售：31,结束：2023-07-31,,,顺誉食品,4.97,4.84,4.77,2023-04-18 22:01:27.475
"顺誉食品广东省内包邮冬菇饺子广式早餐早点传统粤式点心565克",45.0,17.0%,7.65,已售：14,结束：2023-07-31,,,顺誉食品,4.97,4.84,4.77,2023-04-18 22:01:27.573
"顺誉食品广东省内包邮香芋饺子广式早餐早点传统粤式点心565克",45.0,17.0%,7.65,已售：7,结束：2023-07-31,,,顺誉食品,4.97,4.84,4.77,2023-04-18 22:01:27.672
"可剥皮香蕉奶露包2包/230g儿童卡通早餐馒头面点蒸煮速冻食品",26.0,30.0%,7.8,已售：24,结束：2023-06-30,,,耀辉速食专营店,4.69,3.95,4.82,2023-04-18 22:01:27.759
"韩食府友莱玛特韩式辣拌香葱泡菜朝鲜族手工腌制320g*2袋  包邮",34.9,5.0%,1.74,已售：1418,结束：2024-03-04,,,友莱玛特食品专营店,4.88,4.94,4.61,2023-04-18 22:01:27.847
"【贝贝南瓜】壹何水果山东贝贝南瓜3斤/5斤装软糯香甜儿童辅食",25.9,25.0%,6.48,已售：66,结束：2023-06-30,,,壹何水果,4.34,4.57,4.52,2023-04-18 22:01:27.952
"海南金钻凤梨菠萝5/9斤新鲜水果当季香水凤梨特产大果手撕无眼整",32.8,10.0%,3.28,已售：5,结束：2024-06-30,,,果味生鲜企业店,4.2,4.92,4.28,2023-04-18 22:01:28.064
"云南特产正宗石屏烧烤烙锅包浆小豆腐爆浆豆腐免泡200/300g送蘸料",29.9,22.0%,6.58,已售：29,结束：2024-04-30,,,纷享城,4.71,4.55,4.72,2023-04-18 22:01:28.191
"【精九鲜】秘制猪蹄-猪前蹄，肉质劲道，营养丰富。（2只装代购）",69.0,10.0%,6.9,已售：2,结束：2023-08-31,,,京九鲜卤味坊,4.6,4.41,4.71,2023-04-18 22:01:28.292
"佳农宝菜保农残充氮保鲜蒜米100g/袋装(5袋箱） 金乡精选新鲜蒜粒",16.49,20.0%,3.3,已售：57,结束：2023-12-31,,,佳农宝菜生鲜店,4.96,4.91,4.73,2023-04-18 22:01:28.403
"【新鲜采摘】寿光水果小黄瓜5斤 现摘现发无刺黄瓜破损坏果包赔",14.9,15.0%,2.24,已售：147,结束：2023-04-30,,,果乐兜生鲜旗舰店,4.43,4.18,3.55,2023-04-18 22:01:28.507
"广西五彩泡椒农家传统腌制酱香酸辣脆口灯笼七彩椒酱菜300g/200g",19.8,32.0%,6.34,已售：7,结束：2024-03-07,,,桂农优选企业店,4.99,4.89,4.85,2023-04-18 22:01:28.621
"鸡胸肉即食健身代餐饱腹减低脂卡速食午餐高蛋白轻食零食80克/袋",25.9,25.0%,6.48,已售：6,结束：2024-01-01,,,江南以南食品旗舰店,4.76,4.96,4.83,2023-04-18 22:01:28.762
"【趣说邯郸专属】无核黑枣君迁子软枣武安特产野生沙甜软糯特好吃",13.8,12.0%,1.66,已售：9,结束：2023-12-31,,,甲和农业干货企业店,4.05,4.2,4.38,2023-04-18 22:01:28.885
"辣椒炒拉各丝1斤",25.9,25.0%,6.48,已售：2,结束：2023-05-31,1,,邳城农场,4.14,4.5,4.56,2023-04-18 22:01:29.017
"【拍3送1】黑椒鸡块280g/袋鸡肉无需解冻开袋即烹冷冻半成品",9.9,21.0%,2.08,已售：70,结束：2023-05-31,2,3,递一棒FaIthRelay食品专营店,4.87,4.94,4.94,2023-04-18 22:01:29.142
"九味天压缩紫菜干货批发免洗泡发率高鲜嫩懒人必备冲泡即食5g包",9.9,23.0%,2.28,已售：5,结束：2023-06-30,3,,九味天生鲜旗舰店,4.66,4.6,4.66,2023-04-18 22:01:29.262
"涪陵榨菜重庆特产小包装50g鲜脆榨菜丝一箱装佐餐小菜脆爽下饭菜",5.9,22.0%,1.3,已售：8923,结束：2023-11-06,5,,重庆特产供应链,4.57,4.68,4.5,2023-04-18 22:01:29.403
"金钻凤梨热带水果海南新鲜云南当季香水菠萝无眼手撕凤梨2/5/9斤",19.8,10.0%,1.98,已售：5,结束：2024-06-30,,,果味生鲜企业店,4.2,4.92,4.28,2023-04-18 22:01:29.494
"【中农严选】顺丰快递头茬羊角蜜甜瓜春季甜瓜3-4.5斤食用农产品",39.9,15.0%,5.98,已售：0,结束：2023-04-30,,,红石头生鲜旗舰店,4.76,4.99,4.58,2023-04-18 22:01:29.580
"正宗贝贝南瓜粉面板栗小南瓜宝宝辅食香甜5斤包邮",26.8,20.0%,5.36,已售：211,结束：2023-12-31,,,优鲜尚,4.83,4.82,4.78,2023-04-18 22:01:29.671
"葡式蛋挞和蛋挞皮套装包汤圆做好吃的蝴蝶酥苹果派批发零售烤箱",16.8,35.0%,5.88,已售：9,结束：2023-06-01,,,,,,,2023-04-18 22:01:29.764
"山东当季新鲜水果正宗秋月梨新高大果皮薄酥脆爆汁3斤包邮脆甜",26.61,20.0%,5.32,已售：1,结束：2024-03-01,,,百鲜惠生鲜,4.42,4.7,4.57,2023-04-18 22:01:29.883
"盐碱地新鲜草莓西红柿3斤5斤现摘自然熟黄金酸甜比番茄破损包赔",36.5,15.0%,5.48,已售：620,结束：2023-04-30,,,果乐兜生鲜旗舰店,4.43,4.18,3.55,2023-04-18 22:01:29.982
"越南大青芒果精选9斤装青皮新鲜当季现摘热带时令水果农产品生果",25.8,10.0%,2.58,已售：1,结束：2024-06-30,,,果味生鲜企业店,4.2,4.92,4.28,2023-04-18 22:01:30.074
"依禄婷海南冷初榨椰子油8ml*5条新鲜食用植物油椰香天然护肤发",9.9,20.0%,1.98,已售：1.2万,结束：2023-12-31,5,8,嗨喃味供应链,4.64,4.86,4.15,2023-04-18 22:01:30.191
"派绅虾皮90g淡晒小虾米金钩海米紫菜蛋花汤食材福建干货新鲜",19.0,10.01%,1.9,已售：46,结束：2023-12-31,2,,派绅食品旗舰店,4.92,4.44,4.64,2023-04-18 22:01:30.283
"派绅寿司紫菜56g（20片装）紫菜包饭寿司海苔寿司卷食材送竹帘",29.9,10.01%,2.99,已售：11,结束：2023-12-31,2,,派绅食品旗舰店,4.92,4.44,4.64,2023-04-18 22:01:30.401
"DAJIANG/大江大江小酥肉冷冻油炸火锅食材鸡胸鸡肉解馋调味解冻",39.9,15.0%,5.98,已售：34,结束：2023-06-01,1,1,大江生鲜旗舰店,4.82,4.84,4.83,2023-04-18 22:01:30.525
"组合装麻糍传统农家纯手工制作浙江特产糯米糍粑豆沙馅560克细腻",21.8,12.0%,2.62,已售：373,结束：2023-07-31,,,吴先森专营店,4.74,4.97,4.87,2023-04-18 22:01:30.632
"【达人优选】大江吮指系列炸鸡鸡块鸡米花盐酥鸡10袋装鸡肉冷冻",34.9,15.0%,5.24,已售：104,结束：2023-06-01,,,大江生鲜旗舰店,4.82,4.84,4.83,2023-04-18 22:01:30.744
"漳州爆浆水果牛奶玉米 甜玉米食用可生吃 鲜甜4斤装 需冷藏存储",45.9,13.0%,5.97,已售：27,结束：2023-05-31,,,胡巴鲜,4.72,4.86,4.56,2023-04-18 22:01:30.864
"佳农宝菜栗香宝栗南瓜粉糯香甜细腻净重5斤散装健康轻食农产品",39.9,15.0%,5.98,已售：4,结束：2023-05-15,,,佳农宝菜生鲜店,4.96,4.91,4.73,2023-04-18 22:01:30.968
"初荷【玉米热狗卷】儿童早餐半成品学生冷冻速食营养方便懒人馒头",27.8,20.0%,5.56,已售：9,结束：2024-02-14,2,2,初荷食品,4.86,4.69,4.73,2023-04-18 22:01:31.118
"初荷【爆浆红糖糍粑】油炸糯米冷冻速冻半成品火锅店同款小吃食品",22.8,25.0%,5.7,已售：1,结束：2024-02-14,,,初荷食品,4.86,4.69,4.73,2023-04-18 22:01:31.252
"白雪公主白草莓一份750克左右",75.0,1.0%,0.75,已售：45,结束：2024-02-01,,,金鑫果业,4.67,4.87,4.69,2023-04-18 22:01:31.366
"年货必备网红脆皮年糕半成品摆摊小吃韩式酱煎烧烤水磨年糕条500g",12.51,15.0%,1.88,已售：24,结束：2025-11-29,,,巧稻儿年糕店,4.96,4.87,4.72,2023-04-18 22:01:31.483
"主播推荐鱼糕鱼丸组合装火锅食材手工实心鱼圆湖北特产肉糕顺丰",29.9,20.0%,5.98,已售：56,结束：2024-01-17,1,,绿购甄选,4.49,4.65,4.15,2023-04-18 22:01:31.587
"玉米黑麦卷营养早餐半成品面食点心粗粮轻脂馒头包子方便速食批发",18.8,30.0%,5.64,已售：9,结束：2024-10-31,1,,吕禄食品稻南店,4.76,4.96,4.85,2023-04-18 22:01:31.673
"海南品种无籽香水柠檬青果新鲜酸水果广东产地现摘1/2/3/4/5/10斤",14.9,20.0%,2.98,已售：293,结束：2023-07-31,2,,琪源特产,4.79,3.55,4.86,2023-04-18 22:01:31.765
"亲耕 东北黄糯玉米220克*8支/箱  真空包装 软糯香甜味微甜低脂",28.6,20.0%,5.72,已售：26.4万,结束：2023-12-31,,,亲耕官方旗舰店,4.96,4.93,4.6,2023-04-18 22:01:31.862
"【10厂直发-坏单包赔】今味央 大黄米手抓饼80g/片*30片煎饼桶装",29.9,20.0%,5.98,已售：172,结束：2023-09-10,1,,今味央速食旗舰店,4.91,4.94,4.89,2023-04-18 22:01:31.955
"[原味糯米笋]猫小娜免洗鲜嫩笋尖笋丝预制菜凉拌火锅煲汤 250g/包",8.9,30.0%,2.67,已售：67,结束：2023-10-31,2,,猫小娜旗舰店,4.98,4.97,4.59,2023-04-18 22:01:32.058
"源头工厂【生干虾皮60g】不添加盐  海产",19.9,15.0%,2.98,已售：55,结束：2023-12-31,,,一品爽旗舰店,4.38,4.78,4.68,2023-04-18 22:01:32.148
"【中农严选】海南贵妃芒【5斤专用】爆汁皮薄芒果香甜农产品食用",28.41,15.0%,4.26,已售：1,结束：2023-04-30,,,红石头生鲜旗舰店,4.76,4.99,4.58,2023-04-18 22:01:32.239
"澳门特色手信鸡仔饼188g*2永辉烘烤广式点心小吃传统新鲜经典香醇",29.9,15.0%,4.48,已售：6,结束：2023-12-31,,,永辉食品旗舰店,4.67,4.98,4.97,2023-04-18 22:01:32.340
"云南大理高原脆嫩【贡菜】响菜苔干菜零添加净重80g【优质专享】",15.6,26.0%,4.06,已售：15,结束：2023-10-31,,,大理贡菜直发,4.88,4.71,4.53,2023-04-18 22:01:32.435
"【10小包9.9包邮】副五香卤料包150g起炖肉卤肉全料包家用卤味料",9.9,50.0%,4.95,已售：1603,结束：2023-05-12,,,森庄农品旗舰店,4.98,4.43,4.64,2023-04-18 22:01:32.536
"【中农严选】陕西正宗洛川红富士苹果2斤5斤10斤脆甜水果产地直发",21.9,10.0%,2.19,已售：2,结束：2024-04-30,1,,红石头生鲜旗舰店,4.76,4.99,4.58,2023-04-18 22:01:32.644
"【裙带菜】韩式裙带菜干货优选高品质非海带无沙免洗方便10包/盒",17.91,25.0%,4.48,已售：1,结束：2025-04-30,,,瀚宁肴生鲜企业店,4.97,4.82,4.71,2023-04-18 22:01:32.745
"菊苣玉兰菜种籽孑四季盆栽蔬菜秧苗根阳台青菜四季小院庭院土培",9.9,50.0%,4.95,已售：1,结束：2023-12-31,,,禾木种业园艺,4.59,4.56,4.69,2023-04-18 22:01:32.847
"【京东/顺丰包邮】现摘泾阳云阳肉肉家水果西红柿普罗旺斯5斤装",45.0,10.0%,4.5,已售：136,结束：2023-04-30,,,泾阳县肉肉家果蔬种植合作社,4.6,4.51,4.71,2023-04-18 22:01:32.953
"高粱糍粑传统手工制作湖南糍粑好吃美味香高粱糍粑248克*2包24片",10.9,20.0%,2.18,已售：10,结束：2029-03-04,,,宜章县柠檬百货商店,4.66,4.62,4.35,2023-04-18 22:01:33.052
"冰淇淋小薯紫心番薯广东高州一点红番薯3/5/8/9斤小薯50-100g",21.9,20.0%,4.38,已售：15,结束：2023-04-30,,,琪源特产,4.79,3.55,4.86,2023-04-18 22:01:33.148
"裙带菜干货海带嫩苗凉拌免洗裙带菜40g/袋共发3袋脆嫩高泡营养",22.0,20.0%,4.4,已售：2,结束：2023-05-31,,,老范儿的小店,4.6,4.84,4.48,2023-04-18 22:01:33.256
