"【新店福利】正宗潮汕牛肉丸/牛筋丸 汕头潮州特产火锅丸250g",9.9,20.0%,1.98,已售：1442,结束：2023-06-21,,,潮记甄选,4.95,4.91,4.91,2023-04-18 21:49:56.013
"昔日印象鸡汤水浸金枪鱼罐头即食低脂健身沙拉三明治可用海鲜食品",39.9,27.0%,10.77,已售：3087,结束：2024-01-31,55,257,昔日印象轻食旗舰店,4.97,3.89,3.38,2023-04-18 21:49:56.121
"食得迷雪花肉丸228g大份量6粒装简单方便免切免洗加热即食快手菜",9.9,20.0%,1.98,已售：7410,结束：2023-12-30,30,1196,食得迷官方旗舰店,4.99,4.96,4.86,2023-04-18 21:49:56.236
"品八鲜【顺丰包邮】99元5大罐 正宗乳山生蚝260g/罐拍第二单半价",79.8,21.0%,16.76,已售：268,结束：2024-03-31,,,品八鲜厂家小店,4.43,4.66,4.63,2023-04-18 21:49:56.364
"美粮坊脆皮烤肠空气炸锅微波炉做法黑胡椒味原味500g/袋猪肉肠",39.9,22.0%,8.78,已售：5097,结束：2023-07-04,,,美粮坊官方旗舰店,4.88,4.82,4.97,2023-04-18 21:49:56.498
"【朵妈专属】金装手打正宗潮汕牛肉丸新鲜筋道爆汁【送粿条+蒜酥",89.9,32.0%,28.77,已售：2512,结束：2026-06-27,10,69,汕头市潮栩牛肉丸食品商行,4.98,4.98,4.96,2023-04-18 21:49:56.599
"昔日印象【3斤装】黑麦卷饼荞麦卷饼全麦饼低脂粗粮饼皮代餐主食",12.9,30.0%,3.87,已售：4.6万,结束：2024-03-31,165,684,花淡墨食品专营店,4.88,4.9,4.59,2023-04-18 21:49:56.688
"三全馅饼 黑胡椒牛肉馅饼/猪肉大葱馅饼1100g/袋早餐速冻半成品",39.8,25.0%,9.95,已售：1.6万,结束：2023-05-31,54,268,滋美多生鲜专营店,4.96,4.98,4.8,2023-04-18 21:49:56.768
"深海营养五香带鱼罐头100g*10罐  骨酥肉嫩开盖即食拌饭酥香下饭",39.9,25.0%,9.98,已售：262,结束：2024-12-31,,,光合引力生鲜旗舰店,4.73,4.52,4.61,2023-04-18 21:49:56.867
"赣浔名厨盒装黑猪肉肠200g/盒冷鲜肉香肠火山石烤肠火锅",59.8,20.0%,11.96,已售：278,结束：2023-10-06,,,博莱生鲜旗舰店,4.99,4.99,4.99,2023-04-18 21:49:56.952
"【鲜捕头】海味零食组合 烤鳕鱼片+手撕鱿鱼条 营养美味25g*10袋",39.9,26.0%,10.37,已售：2.0万,结束：2023-05-31,,,鲜捕头官方旗舰店,4.86,4.98,4.71,2023-04-18 21:49:57.041
"鸡蛋灌饼 20片 加赠品牌专用酱料 健康轻食早餐方便速食 极速发货",29.9,32.0%,9.57,已售：3567,结束：2023-12-31,25,287,州城鸿福记生鲜旗舰店,4.99,4.96,4.94,2023-04-18 21:49:57.138
"老上海香炸猪排1.5KG大包装约 （10~13片）真空包装鲜嫩",99.0,15.0%,14.85,已售：2.9万,结束：2023-06-29,,,上海骄盛贸易冻品,4.84,4.65,4.92,2023-04-18 21:49:57.232
"丸小明金装牛肉丸【精选黄牛后腿肉】火锅丸子 牛肉丸/牛筋丸500g",138.0,32.0%,44.16,已售：188,结束：2024-04-30,,,丸小明生鲜旗舰店,4.93,4.9,4.78,2023-04-18 21:49:57.318
"展艺速食披萨多口味芝士拉丝多盒加热即食炸锅美食速冻半成品D",36.8,25.0%,9.2,已售：2.3万,结束：2023-07-29,43,279,展艺官方旗舰店,4.98,4.95,4.99,2023-04-18 21:49:57.413
"【2个装】椰子冻 黄金椰粒椰子奶冻 情人亲子新鲜低卡低脂椰子冻",58.0,20.0%,11.6,已售：227,结束：2024-03-23,15,,海蓝鸡鲜生生鲜旗舰店,4.89,3.59,4.96,2023-04-18 21:49:57.517
"大胖和小胖青年萝卜泡菜400g*2袋朝族风味无防腐剂 无色素",28.9,14.0%,4.05,已售：1.0万,结束：2025-02-27,,,大胖小胖的小店,4.98,4.95,4.81,2023-04-18 21:49:57.612
"DAJIANG/大江【工厂直销】大江汉堡上海弄堂里的记忆赠大礼包哦",59.9,15.0%,8.98,已售：5257,结束：2023-05-01,91,298,大江生鲜旗舰店,4.82,4.84,4.83,2023-04-18 21:49:57.712
"【速抢】鸿亮整切调理短柄战斧牛排澳洲谷饲厚切250g5片新鲜带骨",168.0,10.0%,16.8,已售：8868,结束：2023-05-31,,,鸿亮生鲜旗舰店,4.98,4.75,4.99,2023-04-18 21:49:57.806
"珍味小梅园黄金炸猪排350g*3盒/4盒冷冻油炸猪排香酥脆嫩-TY",59.9,15.0%,8.98,已售：8004,结束：2023-04-30,41,299,珍味小梅园生鲜旗舰店,4.98,4.99,4.92,2023-04-18 21:49:57.909
"【顺尔嘉】奥尔良烤翅6根/包*3包鸡全翅对翅半成品空气炸锅美食",69.9,28.0%,19.57,已售：9879,结束：2023-06-04,22,129,顺尔嘉生鲜旗舰店,4.94,4.99,4.95,2023-04-18 21:49:58.019
"【湖中醉】麻辣小龙虾尾250g*8盒 冷冻加热即食生鲜新鲜去虾头 选",99.6,15.0%,14.94,已售：216,结束：2023-09-30,,,湖中醉官方旗舰店,4.97,4.97,4.76,2023-04-18 21:49:58.134
"大连特产 即食海蜇头（200g/袋）  16.9/3袋  亿海湾",16.9,16.0%,2.7,已售：3408,结束：2024-02-29,204,920,圆创优品,4.95,4.68,4.68,2023-04-18 21:49:58.242
"进口原切牛腩1000克/2000克牛肉家庭炖牛腩肥瘦相间鲜嫩冷冻新鲜",79.0,15.0%,11.85,已售：1702,结束：2023-12-31,40,215,澳泽AOZE生鲜旗舰店,4.89,4.95,4.98,2023-04-18 21:49:58.351
"一号农场阳光活力蔬菜沙拉1箱2包开袋即食轻食健身餐400g送沙拉酱",34.9,14.0%,4.89,已售：617,结束：2024-04-30,,,一号农场旗舰店,4.94,4.95,4.91,2023-04-18 21:49:58.462
"【粉丝专享】网易严选 ≥85%含肉量 黑猪肉爆汁烤肠 400克",59.0,20.0%,11.8,已售：220,结束：2025-06-01,,,网易严选官方旗舰店,4.85,4.97,4.97,2023-04-18 21:49:58.565
"【旗舰店】福乐多手撕鱿鱼条40克/袋（拍1发6袋）网红休闲零食",29.9,23.0%,6.88,已售：6504,结束：2024-03-17,99,399,福乐多生鲜旗舰店,4.98,4.5,4.75,2023-04-18 21:49:58.653
"广西红心芭乐番石榴软糯香甜新鲜水果赠送酸梅粉应季芭乐3-5斤",32.9,20.0%,6.58,已售：394,结束：2023-06-30,,,果优鲜农产品,4.5,4.79,4.42,2023-04-18 21:49:58.731
"山东正宗春季甜瓜博洋9号3-5斤装脆嫩鲜甜香甜蜜瓜坏果包赔",39.9,15.0%,5.98,已售：432,结束：2023-05-31,,,西安一禾生态农业有限公司的小店,4.62,4.67,4.03,2023-04-18 21:49:58.827
"赣浔名厨【工厂直供】墨鱼汁烤肠240g*3鲜嫩火山肠火锅烧烤食材",39.9,20.0%,7.98,已售：4717,结束：2023-08-08,56,329,博莱生鲜旗舰店,4.99,4.99,4.99,2023-04-18 21:49:58.920
"【钊玮严选】香水小菠萝 当季新鲜水果整箱 单果300g+ 净重5斤装",28.8,15.0%,4.32,已售：576,结束：2023-11-30,,,采蘩生鲜旗舰店,4.48,4.52,4.41,2023-04-18 21:49:59.007
"「舌尖满分」粗粮粘豆包 纯粗粮  营养早餐  健康代餐（每袋6个）",59.9,25.0%,14.98,已售：2583,结束：2023-07-30,25,168,舌尖满分速食旗舰店,4.99,4.96,4.97,2023-04-18 21:49:59.094
"蚝皇牛肉片250g 蚝油牛柳耗油牛柳牛肉片酒店餐厅抄牛肉中式餐饮",55.9,15.0%,8.38,已售：3578,结束：2024-01-31,134,313,英鑫食品生鲜专营店,4.99,4.92,4.99,2023-04-18 21:49:59.188
"肯德基自在厨房 爆汁脆皮香骨鸡*3袋+原味/藤椒劲爆鸡米花任选2袋",79.0,20.0%,15.8,已售：396,结束：2023-04-30,28,158,肯德基自在厨房官方旗舰店,4.99,4.62,4.99,2023-04-18 21:49:59.278
"重庆麻辣萝卜干 袋装500克 香辣下饭菜开胃菜 木洞老同学  即食",9.9,5.0%,0.5,已售：13.6万,结束：2023-12-31,,,木洞老同学旗舰店,4.94,4.31,4.6,2023-04-18 21:49:59.373
"正宗山东溏心紫芋新鲜流油紫薯（粉糯香甜 新鲜直发）5斤甜糯皮薄",35.9,25.0%,8.98,已售：2273,结束：2023-06-30,48,270,壹亩地瓜生鲜旗舰店,4.85,4.68,4.71,2023-04-18 21:49:59.475
"【顺丰包邮】微山湖田螺肉清水田螺新鲜挑肉真空包装250g手工",13.3,18.0%,2.39,已售：1016,结束：2023-04-30,,,蒙泰鲜食品,4.94,4.62,4.73,2023-04-18 21:49:59.579
"湖北蒸烤型蜜薯香甜地瓜食用红心蜜薯早餐代餐粗粮净重5斤",22.5,26.0%,5.85,已售：1.4万,结束：2024-04-30,,,三生三世桃花故里生鲜旗舰店,4.85,4.96,4.75,2023-04-18 21:49:59.683
"【爆款推荐】喜味圣嵊州老面小笼包半成品速冻小笼包营养早餐速食",43.0,25.0%,10.75,已售：230,结束：2023-06-30,,,喜味圣生鲜,4.88,4.72,4.8,2023-04-18 21:49:59.792
"【宠粉】云南新鲜沃柑3斤当季应季时令橘子桔子柑橘甜皮薄香甜",9.9,15.0%,1.48,已售：1639,结束：2023-06-30,85,,源头甄选企业店,4.72,4.75,4.34,2023-04-18 21:49:59.893
"【鱼干专属】正宗潮汕牛肉丸4斤8袋送粿条送酱料包新鲜筋道爆汁",99.9,25.0%,24.98,已售：101,结束：2026-05-08,,,潮丸哥生鲜食品店,4.9,4.96,4.94,2023-04-18 21:49:59.996
"【大希地推荐】巴沙鱼无骨无刺去皮新鲜冷冻200g*6袋冷冻鱼鱼柳",79.9,20.0%,15.98,已售：6788,结束：2023-10-07,38,155,大希地官方旗舰店,4.86,4.94,4.99,2023-04-18 21:50:00.102
"【露茵】有机富硒彩糯玉米 非转基因 真空锁鲜 天然膳食 200g*8支",49.99,22.0%,11.0,已售：3777,结束：2023-08-05,49,219,露茵官方旗舰店,4.98,4.96,4.77,2023-04-18 21:50:00.202
"彦伯新鲜鱿鱼须500g*5袋脆口好吃海鲜烧烤爆炒香辣鱿鱼火锅食材",79.0,13.0%,10.27,已售：238,结束：2023-06-30,75,,彦伯官方旗舰店,4.96,4.95,4.71,2023-04-18 21:50:00.352
"彤怼怼 果蔬杂粮馒头400*3袋共1200g 孕妇餐减脂早餐粗粮控糖",29.9,25.0%,7.48,已售：5462,结束：2023-12-01,74,295,彤怼怼食品旗舰店,4.83,4.9,4.46,2023-04-18 21:50:30.839
"【味层香】山东粗粮粘豆包低脂无糖精100g*10个独立包装冷冻手工",29.9,20.0%,5.98,已售：3.5万,结束：2023-08-16,87,388,味层香旗舰店,4.89,4.84,4.66,2023-04-18 21:50:30.939
"华盛优质营养熟虾皮100g*5包快速锁鲜低湿度温州水产干货新鲜天然",29.9,17.0%,5.08,已售：516,结束：2023-07-31,,,多瑞麦,4.82,4.94,4.85,2023-04-18 21:50:31.027
"（粉丝福利）辣太婆火锅鸡家庭火锅套餐（微辣）1.5千克",39.99,25.0%,10.0,已售：2.3万,结束：2023-07-01,25,226,辣太婆火锅休闲食品工厂店,4.5,4.51,4.85,2023-04-18 21:50:31.112
"敦状元【低脂】东北特产手工煎饼藜麦粗粮煎饼手撕筋道50g*15袋",29.9,25.0%,7.48,已售：826,结束：2023-04-26,39,,敦状元生鲜旗舰店,4.94,4.8,4.74,2023-04-18 21:50:31.205
"享食水晶薄皮素包子山野菜早餐半成品小笼包儿童早餐面点懒人速食",32.9,25.0%,8.22,已售：291,结束：2024-03-01,,,享食生鲜旗舰店,4.87,4.98,4.93,2023-04-18 21:50:31.321
"【猫山王榴莲味】大家乐大黄米汤圆元宵2袋包邮",49.8,23.0%,11.45,已售：4.5万,结束：2023-05-23,35,191,田园茂生鲜食品供应链,4.61,4.97,4.68,2023-04-18 21:50:31.446
" 龙须菜250g/袋【拍4送3共7袋】",19.9,40.0%,7.96,已售：6971,结束：2023-06-30,,,禾绿水产,4.65,4.87,4.56,2023-04-18 21:50:31.546
"【拍一发八】仲秋麻辣龙虾尾套餐送土豆粉260g/40-45只蒜蓉十三香",59.9,20.0%,11.98,已售：2376,结束：2023-07-01,,,仲秋生鲜旗舰店,4.53,4.92,4.92,2023-04-18 21:50:31.659
"低脂代餐/粗粮粘豆包/早餐包/方便营养传统手工制作香甜软糯 100g",29.9,20.0%,5.98,已售：1.7万,结束：2023-04-30,95,367,小禾粗粮,4.93,4.92,4.91,2023-04-18 21:50:31.790
"【直播推荐】吉香居暴下饭酸菜牛肉香菇牛肉下饭酱组合装200g*4瓶",29.8,22.0%,6.56,已售：6117,结束：2023-11-21,84,,吉香居官方旗舰店,4.98,4.98,4.77,2023-04-18 21:50:31.912
"啤仔麻辣蟹钳500g/罐即食捞汁海鲜休闲零食网红爆款下饭生腌蟹腿",39.9,27.0%,10.77,已售：197,结束：2024-08-31,2,,啤仔,4.39,4.81,4.52,2023-04-18 21:50:32.033
"【都乐Dole】 陕西富士苹果礼盒 净重4.5斤12只 精美礼盒 脆甜",39.9,12.0%,4.79,已售：1.6万,结束：2023-09-30,160,484,都乐Dole生鲜旗舰店,4.77,4.73,4.81,2023-04-18 21:50:32.164
"【顺丰冷链】泰式甜辣生呛无皮虾300g/罐即食生腌酸辣柠檬虾海鲜",39.0,22.0%,8.58,已售：526,结束：2025-03-31,10,256,美味鲜卤班,4.84,4.99,4.69,2023-04-18 21:50:32.308
"【老母鸡或老鸭】杨博士散养土鸡或土鸭（单只净重1.8-2.5斤）",168.0,15.0%,25.2,已售：2.1万,结束：2023-08-31,8,85,杨博士生鲜旗舰店,4.97,4.99,4.94,2023-04-18 21:50:32.429
"内蒙古散养屠宰羊肉真空包装肚包肉2斤+羊肉肠2斤 （送韭菜花酱）",269.0,25.0%,67.25,已售：1.3万,结束：2023-12-31,10,33,喜气羊羊企业店,4.66,4.64,4.65,2023-04-18 21:50:32.546
"烤芝士牛肉卷早餐秘制爆汁鸡肉卷速食半成品",26.8,15.0%,4.02,已售：755,结束：2023-06-30,1,270,耀辉速食专营店,4.69,3.95,4.82,2023-04-18 21:50:32.664
"【厨上厨】湘西外婆菜158g*3袋  口感脆嫩 做法多样下饭菜",7.9,15.0%,1.18,已售：2276,结束：2024-01-31,42,1922,厨上厨生鲜旗舰店,4.98,4.95,4.86,2023-04-18 21:50:32.791
"思念大黄米汤圆低糖黑芝麻汤圆网红元宵大汤圆400g*4袋 不糊锅",49.9,25.0%,12.48,已售：2.1万,结束：2024-02-29,31,173,思念速食旗舰店,4.93,4.88,4.99,2023-04-18 21:50:32.910
"3袋起9.9贡菜专供安徽涡阳贡菜脱水蔬菜80克独立包装日晒苔干",15.8,21.0%,3.32,已售：682,结束：2023-08-31,,,紫金鲜,4.98,4.96,4.78,2023-04-18 21:50:33.037
"香酥手抓饼批发早餐煎饼鸡蛋灌饼大号大片手抓饼千层饼皮家庭装",19.9,27.0%,5.37,已售：1355,结束：2024-02-29,,,李大爷食品旗舰店,4.93,4.95,4.61,2023-04-18 21:50:33.168
"珍味小梅园老上海正宗葱油饼500g*4包速冻早餐饼美食半成品-TY",39.9,12.0%,4.79,已售：9244,结束：2023-12-31,89,463,珍味小梅园生鲜旗舰店,4.98,4.99,4.92,2023-04-18 21:50:33.274
"大由大老上海葱油饼儿童早餐传统营养速食饼皮手抓饼酥脆冷冻食品",26.8,26.0%,6.97,已售：4.8万,结束：2023-11-09,43,316,大由大旗舰店,4.89,4.96,4.93,2023-04-18 21:50:33.366
"柳伍剁椒鱼头650g*3袋 新鲜好吃香辣肉质鲜嫩新鲜下饭顺丰包邮",69.9,25.0%,17.48,已售：7363,结束：2024-12-31,10,97,柳伍官方旗舰店,4.75,4.84,4.68,2023-04-18 21:50:33.465
"【尚巧厨】展艺速食披萨半成品加热即食奥尔良芝士榴莲披萨比萨D",36.8,25.0%,9.2,已售：7.6万,结束：2023-10-31,39,232,尚巧厨卖场旗舰店,4.99,4.93,4.99,2023-04-18 21:50:33.553
" 【藻味生活】即食香辣裙带菜梗段195g/袋 开袋即食（甜辣口感）",7.9,25.0%,1.98,已售：2.8万,结束：2023-12-31,218,1123,藻味生活食品旗舰店,4.99,4.85,4.69,2023-04-18 21:50:33.668
"【爆款】Anemon3爱你们宁波水磨年糕真空包装 软糯Q弹有嚼劲 粳米",9.9,25.0%,2.48,已售：1.3万,结束：2023-08-01,210,873,ANEMON3旗舰店,4.92,4.68,4.54,2023-04-18 21:50:33.782
"乌江榨菜丝30g*10袋量贩装 清淡微辣 口味可选 新老包装随机发",9.9,17.0%,1.68,已售：4039,结束：2024-04-30,345,1316,乌江惠聚天下专卖店,4.91,4.92,4.77,2023-04-18 21:50:33.876
"壮元海带鱼罐头150g*10罐固形物≥75%五香香辣刺酥肉嫩开盖即食",59.9,20.0%,11.98,已售：8433,结束：2024-02-21,151,167,壮元海旗舰店,4.85,4.97,4.73,2023-04-18 21:50:33.978
"腾云龙树熟烤榴莲金枕A+无核纯果肉熟包去核泰国冷冻保鲜0添加",88.0,15.0%,13.2,已售：517,结束：2023-06-01,41,155,腾云供应链,4.35,4.58,4.83,2023-04-18 21:50:34.082
" 幸福西饼 0蔗糖8大0添加蛋挞皮蛋挞液酥脆奶香套装",119.8,20.0%,23.96,已售：143,结束：2023-12-31,83,,幸福西饼烘焙旗舰店,4.87,4.98,4.98,2023-04-18 21:50:34.190
"湾仔码头严选水晶汤圆晶彩组合装3包+赠黑芝麻汤圆2包",59.9,20.0%,11.98,已售：3.4万,结束：2023-07-31,19,181,湾仔码头官方旗舰店,4.99,4.93,4.97,2023-04-18 21:50:34.301
"皮厨大叔扬州风味黑猪肉红烧狮子头新鲜营养一袋6个300克手工优质",35.0,21.0%,7.35,已售：4.0万,结束：2024-01-30,66,296,皮厨大叔生鲜旗舰店,4.98,4.98,4.99,2023-04-18 21:50:34.416
"【达人小皇鸡】正宗清远鸡客家古法盐焗鸡600±100g手撕鸡散养",109.0,20.0%,21.8,已售：6.5万,结束：2023-05-13,17,98,达人小皇鸡旗舰店,4.79,4.57,4.41,2023-04-18 21:50:34.528
"豫鲜生臻选河南开封纯沙地西瓜红蜜薯5/9斤装产地现挖现发",20.9,24.0%,5.02,已售：5765,结束：2023-12-31,33,372,豫鲜生臻选企业店,3.97,4.7,4.35,2023-04-18 21:50:34.635
"山东普罗旺斯西红柿3/4.5斤 新鲜番茄可生吃自然熟小番茄现摘包邮",29.9,13.0%,3.89,已售：2.6万,结束：2023-05-31,,,甘福园官方旗舰店,4.52,4.99,4.5,2023-04-18 21:50:34.755
"鲜到鲜得舟山带鱼3kg 去头去尾 到手6斤 新鲜海捕 雷达网速冻海捕",159.0,18.0%,28.62,已售：1.7万,结束：2023-12-31,,,鲜到鲜得官方旗舰店,4.95,4.94,4.68,2023-04-18 21:50:34.874
"【华誉食品】儿童肠400克 果木熏烤哈尔滨风味真空包装便捷食用  ",29.8,21.0%,6.26,已售：492,结束：2023-05-31,100,,华誉食品,4.98,4.91,4.87,2023-04-18 21:50:34.996
"重庆麻辣大头菜榨菜片 农家下饭菜 开胃菜 即食袋装 500克 包邮",9.9,10.0%,0.99,已售：2254,结束：2023-12-31,,,木洞老同学旗舰店,4.94,4.31,4.6,2023-04-18 21:50:35.109
"FeiShu/肥叔油条糍粑 包麻糍 半成品早餐 儿童速食油炸网红小吃",39.9,28.0%,11.17,已售：2.7万,结束：2023-12-31,62,,肥叔旗舰店,4.93,4.91,4.94,2023-04-18 21:50:35.225
"临安小香薯5斤软糯香甜天目山小红薯地瓜甜糯皮薄农产品2斤3斤",19.9,15.0%,2.98,已售：29.9万,结束：2023-09-30,,,每家每户官方旗舰店,4.72,4.69,4.93,2023-04-18 21:50:35.352
"【真功夫】功夫外婆菜 百搭下饭菜150g/包  开袋即食（拍一发3）",9.9,25.0%,2.48,已售：851,结束：2023-06-25,29,,真功夫官方旗舰店,4.97,4.85,4.96,2023-04-18 21:50:35.462
"渝是乎x辣尚瘾联名 重庆万州麻辣烤鱼1.26kg 成品预制菜加热即食",79.0,20.0%,15.8,已售：1.3万,结束：2023-04-30,19,131,渝是乎旗舰店,4.97,4.9,4.92,2023-04-18 21:50:35.556
"东上御品大片毛肚手撕高品质叶片500g*3袋固化物80新鲜脆爽冷藏",146.0,12.0%,17.52,已售：9035,结束：2024-02-18,,,东上御品旗舰店,4.95,4.94,4.84,2023-04-18 21:50:35.653
"【顺丰包邮】鱻谣大号黑虎虾仁200g/袋*3宝宝辅食鲜剥虾仁去虾线",108.0,15.0%,16.2,已售：333,结束：2024-03-31,,,鱻谣官方旗舰店,4.99,4.99,4.98,2023-04-18 21:50:35.748
"楚丹松花蛋皮蛋20枚装1200克无铅工艺恒温腌制嫩蛋溏心鸭皮蛋醇香",36.9,17.0%,6.27,已售：1.6万,结束：2023-06-30,50,289,楚丹旗舰店,4.88,4.78,4.5,2023-04-18 21:50:35.847
"【中通+顺丰】正宗老上海风味葱油饼20片1800g早餐饼冷冻半成品 ",35.8,22.0%,7.88,已售：9679,结束：2024-01-31,62,269,豪饱饱食品,4.99,4.86,4.98,2023-04-18 21:50:35.948
"【新品】思念发面鲜美肉馅小笼包包子半成品早餐到手5袋",49.9,20.0%,9.98,已售：204,结束：2024-03-31,10,,思念速食旗舰店,4.93,4.88,4.99,2023-04-18 21:50:36.045
"霍嘉萝卜丝酥皮馅饼10片装1150克早餐煎饼白吉馍酥饼牛肉饼猪肉饼",29.8,30.0%,8.94,已售：6735,结束：2023-09-12,45,224,稀饭饱饱生鲜,4.97,4.71,4.92,2023-04-18 21:50:36.144
"送礼佳品 猫山王榴莲千层450g 买一赠二戚风蛋糕 到手三件 DP",69.9,20.0%,13.98,已售：7207,结束：2023-05-21,27,126,榴莲西施旗舰店,4.89,4.81,4.85,2023-04-18 21:50:36.251
"山东羊角蜜甜瓜大果新鲜水果现摘脆甜清爽蜜瓜香甜带箱3/5斤",33.8,20.0%,6.76,已售：924,结束：2023-05-31,38,255,每日优鲜,4.78,4.94,4.74,2023-04-18 21:50:36.351
"舌味仙柠檬酸辣蒜香酸甜辣无骨鸡爪1000克/罐",49.9,18.0%,8.98,已售：1.1万,结束：2023-12-25,,,舌味仙商行,4.84,4.19,3.02,2023-04-18 21:50:36.468
"榴六六严选【10盒巨划算】泰国金枕老树无核树熟榴莲果肉100g/盒",199.0,16.0%,31.84,已售：1605,结束：2023-05-31,12,60,榴六六生鲜旗舰店,4.74,4.83,4.82,2023-04-18 21:50:36.576
"广西特产五彩泡椒香辣爽脆农家传统腌制528g/300g/200g开胃下饭菜",9.9,27.0%,2.67,已售：3047,结束：2024-03-03,,,桂农优选企业店,4.99,4.89,4.85,2023-04-18 21:50:36.706
"千牛优福新鲜沙拉蔬菜6种组合装共4斤 轻食健身沙拉材料 顺丰包邮",34.8,10.0%,3.48,已售：1230,结束：2023-04-30,,,千牛优福生鲜旗舰店,4.87,4.87,4.97,2023-04-18 21:50:36.819
"邕桂妃糯米小丸子奶茶甜品元宵多种冷冻酒酿小汤圆200g*2袋",15.9,30.0%,4.77,已售：712,结束：2023-08-27,211,541,邕桂妃生鲜旗舰店,4.99,4.9,4.74,2023-04-18 21:50:36.945
"野湾港霞浦虾皮淡干虾皮宝宝辅食钙鲜海鲜小虾米海带紫菜煲汤120g",14.8,25.0%,3.7,已售：571,结束：2024-03-01,67,519,野湾港生鲜旗舰店,4.99,4.94,4.97,2023-04-18 21:50:37.058
"沂蒙山 红羽大公鸡  整只净重4斤 顺丰 京东包邮",99.0,15.0%,14.85,已售：2.4万,结束：2023-11-30,37,130,膳存生鲜,4.95,4.78,4.71,2023-04-18 21:50:37.179
"【贵妃枣】大青枣包邮台湾牛奶青枣现摘现发3斤5斤冬枣枣应季水果",29.9,15.0%,4.48,已售：771,结束：2023-12-31,,,大头食品鲜果,4.84,4.95,4.56,2023-04-18 21:50:37.304
"刘敬贤秘制麻椒鸡卤熏制麻辣诱人真空包装冷冻整鸡缓化即食850gTY",69.9,20.0%,13.98,已售：7519,结束：2024-03-22,,,刘敬贤生鲜旗舰店,4.99,4.91,4.94,2023-04-18 21:50:37.425
"山西 隰县奶油红富士苹果8颗6斤装 奶油苹果礼盒装送礼 苹果 水果",123.0,20.0%,24.6,已售：132,结束：2024-02-29,,,隰县玉露香梨严选店,4.98,4.92,4.58,2023-04-18 21:50:37.547
"素亿家【央视网选】香椿芽手抓饼80g*20片/桶 早晚餐速食冷冻桶装",29.9,20.0%,5.98,已售：451,结束：2023-05-31,32,330,素亿家生鲜旗舰店,4.96,4.78,4.88,2023-04-18 21:50:37.666
"【美好食品】美好猪肉肠脆皮肠爆汁烤肠十根700g香肠",59.9,20.0%,11.98,已售：921,结束：2023-06-29,,,美好生鲜旗舰店,4.95,3.67,4.91,2023-04-18 21:50:37.760
"【爆款推荐】东北酸菜水饺猪肉酸菜早餐速食煎饺水饺速冻新鲜",52.9,25.0%,13.22,已售：549,结束：2023-07-30,18,143,头厨官方旗舰店,4.99,4.99,4.99,2023-04-18 21:50:37.859
"海苔大饭团8个装奥尔良风味/肉松风味全熟微波蒸煮营养早餐批发",31.9,20.0%,6.38,已售：392,结束：2023-07-31,,,馨望美食小店,4.92,4.79,4.7,2023-04-18 21:50:37.952
"赣浔名厨秘制酱猪肝200g/袋真空新鲜食材鲜嫩营养熟食加热即食",9.9,15.0%,1.48,已售：1381,结束：2023-10-06,,,博莱生鲜旗舰店,4.99,4.99,4.99,2023-04-18 21:50:38.049
"【买3送1】优信正宗潮汕手工墨鱼丸 精选大墨斗肉鲜嫩250g/包冷冻",116.0,20.0%,23.2,已售：3309,结束：2023-06-30,,,潮味优信官方旗舰店,4.99,4.91,4.98,2023-04-18 21:50:38.153
"彤怼怼造型果蔬卡通包250g*包早餐速食馒头软糯香甜菠菜胡萝卜",29.9,27.0%,8.07,已售：6.3万,结束：2023-07-31,41,229,彤怼怼食品旗舰店,4.83,4.9,4.46,2023-04-18 21:50:38.246
"林谷鲜【现货发货】吉林长白山人参 100g（单支约10g）顺丰到家",19.9,8.0%,1.59,已售：10.1万,结束：2023-10-31,211,1132,林谷鲜生鲜旗舰店,4.85,4.95,4.62,2023-04-18 21:50:38.343
" 源可滋榴莲爆浆球下午茶麻薯糕点*15个",29.9,20.0%,5.98,已售：1384,结束：2023-12-31,35,296,元源食品,4.89,4.61,4.51,2023-04-18 21:50:38.451
"大丰斋玉米馒头260g*4袋速冻五谷杂粮早餐玉米味儿童面点杂粮包",27.9,20.0%,5.58,已售：1252,结束：2025-03-06,,,大丰斋旗舰店,4.99,4.75,4.65,2023-04-18 21:50:38.545
"【正宗孙记】丰都麻辣鸡400g传统拌料跑山鸡麻辣鲜香鸡肉开胃",39.9,10.0%,3.99,已售：7264,结束：2023-06-30,91,,华明孙记食品旗舰店,4.97,4.59,4.99,2023-04-18 21:50:38.658
"佳沃泰国冷冻金枕榴莲 无核果肉 8盒装（100g/盒）可烤制榴莲-TZ",149.9,12.0%,17.99,已售：951,结束：2023-07-05,,,佳沃joyvio官方旗舰店,4.83,4.97,4.93,2023-04-18 21:50:38.765
"【顺丰冷链】香辣鲍鱼螺老婆脚网红香辣猫眼螺即食新鲜罐装330g",39.9,18.0%,7.18,已售：886,结束：2023-11-30,42,241,美味鲜卤班,4.84,4.99,4.69,2023-04-18 21:50:38.885
"顺生海蜇 减盐海蜇丝275gX6袋 海蜇皮即食凉拌 包邮",19.9,30.0%,5.97,已售：2392,结束：2023-06-30,62,299,顺生生鲜旗舰店,4.92,4.52,4.53,2023-04-18 21:50:38.993
"泡椒鱼皮 开袋即食食用凉菜冷冻150g/袋腌制食品",3.9,5.0%,0.2,已售：1.1万,结束：2023-04-30,,,布七客生鲜,4.97,4.69,4.58,2023-04-18 21:50:39.114
"ARNO/阿诺早餐点心黑糯米糕莲子黑米糕速冻紫米糕360g*4袋 48粒",39.9,20.0%,7.98,已售：827,结束：2024-03-16,42,231,ARNO阿诺官方旗舰店,4.99,4.86,4.97,2023-04-18 21:50:39.238
"桂花小圆子糯米丸子奶茶香甜配料半成品500g元宵酒酿小汤圆糯米粉",13.8,22.0%,3.04,已售：7835,结束：2023-09-30,72,514,焙小姐小北店,4.98,3.56,4.96,2023-04-18 21:50:39.365
"广东茂名冰淇淋红薯一点红番薯紫心地瓜粉香糯甜新鲜现挖5斤9斤",23.8,20.0%,4.76,已售：3582,结束：2023-12-31,50,,正宗茂名特产,4.84,4.69,4.73,2023-04-18 21:50:39.493
"魔芋豆腐260g袋装0脂低卡手工新鲜即食代餐炒菜凉拌火锅串串食材",17.8,25.0%,4.45,已售：1.6万,结束：2023-09-24,30,343,原上良仓,4.94,4.98,4.58,2023-04-18 21:50:39.625
"【北海湾】新鲜虾滑≥95%大颗粒150g*6袋手打特级",99.0,17.0%,16.83,已售：2.9万,结束：2024-02-18,,,北海湾旗舰店,4.95,4.93,4.92,2023-04-18 21:50:39.743
"【万宁黄金椰】海南椰青黄金椰子产地现摘新鲜带皮金椰子孕妇水果",69.0,20.0%,13.8,已售：413,结束：2023-07-31,,,安优果,4.65,4.97,4.5,2023-04-18 21:50:39.852
"千味央厨茴香小油条240g火锅小油条早餐油条油条半成品",16.9,25.0%,4.22,已售：7163,结束：2023-11-30,58,422,滋美多生鲜专营店,4.96,4.98,4.8,2023-04-18 21:50:39.961
"BEI DOU BEAR/北斗熊【现挖现发】山东牛奶小芋头软糯香甜5斤装",54.9,20.0%,10.98,已售：3605,结束：2023-05-31,19,126,北斗熊旗舰店,4.82,4.32,4.46,2023-04-18 21:50:40.056
